{
  "schemaVersion": "1.0.0",
  "machineId": "kyoraku_denoh",
  "name": { "jp": "仮面ライダー電王" },
  "maker": "京楽",
  "introductionMonth": "2025-03",
  "numberClass": "6.6号機",
  "type": "AT",
  "tags": ["テスト", "β開始用"],
  "references": [
    { "title": "メーカー公式", "url": "https://example.com/denoh" }
  ],
  "labelsJP": {
    "betCount": "ベット数",
    "hitCount": "ヒット数",
    "ratio": "比率",
    "zscore": "Zスコア",
    "shrink": "縮約推定値"
  },
  "io": {
    "inputs": [
      {
        "key": "betCount",
        "labelJP": "ベット数",
        "type": "number",
        "required": true,
        "min": 1,
        "step": 1,
        "precision": 0
      },
      {
        "key": "hitCount",
        "labelJP": "ヒット数",
        "type": "number",
        "required": true,
        "min": 0,
        "step": 1,
        "precision": 0
      }
    ],
    "outputs": [
      { "key": "ratio", "labelJP": "比率", "type": "number", "precision": 4 },
      { "key": "zscore", "labelJP": "Zスコア", "type": "number", "precision": 3 },
      { "key": "shrink", "labelJP": "縮約推定値", "type": "number", "precision": 4 }
    ]
  },
  "scoring": {
    "method": "ratio",
    "params": {
      "numeratorKey": "hitCount",
      "denominatorKey": "betCount",
      "priorStrength": 1,
      "priorMean": 0.5
    }
  },
  "notes": "β開始のI/O雛形。UI配線は次ステップで行う。"
}
